<?xml version="1.0" encoding="ISO-8859-1"?>
<!DOCTYPE category SYSTEM "category.dtd">
<category edit="all" name="Fils RSS de l'université" ttl="">
	<description>Fils RSS Rennes 1</description>
	
	<sourceProfiles>
		<sourceProfile id="un" access="public" name="Site de l'université" 
		 specificUserContent="no" ttl="86400" url="http://www.univ-rennes1.fr/bas-de-page/RSS/ENT/RSS-toutes-les-actus">
			<visibility>
			    <obliged>
				<group name="local.0"/>  <!-- Tous les groupes de personnes -->
				<group name="local.15"/> <!-- Anonymes -->
			    </obliged>
			</visibility>		
		</sourceProfile>
		<sourceProfile id="deux" access="public" name="Etat des réseaux et services" 
		 specificUserContent="no" ttl="3600" url="http://info.cri.univ-rennes1.fr/rss/rss.php">
			<visibility>
			    <obliged>
				<group name="local.0"/>  <!-- Tous les groupes de personnes -->
				<group name="local.15"/> <!-- Anonymes -->
			    </obliged>
			</visibility>		
		</sourceProfile>
	</sourceProfiles>
	
	<visibility>
		<obliged>
			<group name="local.0"/>  <!-- Tous les groupes de personnes -->
			<group name="local.15"/> <!-- Anonymes -->
		</obliged>
	</visibility>
</category>
